rank,name,author,link,star,fork,language,issues,description,last_commit
1,awesome-ios,vsouza,https://github.com/vsouza/awesome-ios,46660,6820,Swift,1,"A curated list of awesome iOS ecosystem, including Objective-C and Swift Projects",2024-07-22T12:55:47Z
2,Alamofire,Alamofire,https://github.com/Alamofire/Alamofire,40871,7529,Swift,38,Elegant HTTP Networking in Swift,2024-08-07T20:40:44Z
3,iina,iina,https://github.com/iina/iina,37381,2542,Swift,1623,The modern video player for macOS.,2024-08-11T02:06:08Z
4,ShadowsocksX-NG,shadowsocks,https://github.com/shadowsocks/ShadowsocksX-NG,32281,7953,Swift,308,Next Generation of ShadowsocksX,2023-03-29T02:14:51Z
5,swift-algorithm-club,kodecocodes,https://github.com/kodecocodes/swift-algorithm-club,28658,5002,Swift,31,"Algorithms and data structures in Swift, with explanations!",2024-05-09T19:16:57Z
6,Charts,ChartsOrg,https://github.com/ChartsOrg/Charts,27461,5977,Swift,865,Beautiful charts for iOS/tvOS/OSX! The Apple side of the crossplatform MPAndroidChart.,2024-08-05T10:26:18Z
7,MonitorControl,MonitorControl,https://github.com/MonitorControl/MonitorControl,27012,805,Swift,26,🖥 Control your display's brightness & volume on your Mac as if it was a native Apple Display. Use Apple Keyboard keys or custom shortcuts. Shows the native macOS OSDs.,2024-06-29T14:24:39Z
8,UTM,utmapp,https://github.com/utmapp/UTM,25884,1305,Swift,794,Virtual machines for iOS and macOS,2024-08-06T22:43:11Z
9,lottie-ios,airbnb,https://github.com/airbnb/lottie-ios,25564,3721,Swift,21,An iOS library to natively render After Effects vector animations,2024-08-10T17:32:20Z
10,Rectangle,rxhanson,https://github.com/rxhanson/Rectangle,25374,754,Swift,81,Move and resize windows on macOS with keyboard shortcuts and snap areas,2024-08-09T04:41:19Z
11,RxSwift,ReactiveX,https://github.com/ReactiveX/RxSwift,24279,4167,Swift,15,Reactive Programming in Swift,2024-08-05T23:29:38Z
12,vapor,vapor,https://github.com/vapor/vapor,24172,1430,Swift,87,💧 A server-side Swift HTTP web framework.,2024-08-11T02:13:06Z
13,stats,exelban,https://github.com/exelban/stats,23989,798,Swift,26,macOS system monitor in your menu bar,2024-08-04T11:14:04Z
14,Kingfisher,onevcat,https://github.com/onevcat/Kingfisher,23035,2637,Swift,144,"A lightweight, pure-Swift library for downloading and caching images from the web.",2024-08-08T12:44:23Z
15,SwiftyJSON,SwiftyJSON,https://github.com/SwiftyJSON/SwiftyJSON,22551,3421,Swift,114,The better way to deal with JSON data in Swift.,2024-08-10T17:21:37Z
16,Hero,HeroTransitions,https://github.com/HeroTransitions/Hero,21982,1720,Swift,38,Elegant transition library for iOS & tvOS,2024-02-06T02:04:31Z
17,Aerial,JohnCoates,https://github.com/JohnCoates/Aerial,20762,1049,Swift,70,Apple TV Aerial Screensaver for Mac,2024-04-28T14:31:37Z
18,CodeEdit,CodeEditApp,https://github.com/CodeEditApp/CodeEdit,20685,986,Swift,215,"CodeEdit App for macOS – Elevate your code editing experience. Open source, free forever.",2024-08-10T15:20:26Z
19,ReactiveCocoa,ReactiveCocoa,https://github.com/ReactiveCocoa/ReactiveCocoa,19928,3469,Swift,4,Cocoa framework and Obj-C dynamism bindings for ReactiveSwift.,2024-05-19T02:53:00Z
20,SnapKit,SnapKit,https://github.com/SnapKit/SnapKit,19868,1968,Swift,38,A Swift Autolayout DSL for iOS & OS X,2024-07-07T13:58:39Z
21,SwiftLint,realm,https://github.com/realm/SwiftLint,18526,2208,Swift,369,A tool to enforce Swift style and conventions.,2024-08-10T22:17:06Z
22,IQKeyboardManager,hackiftekhar,https://github.com/hackiftekhar/IQKeyboardManager,16415,2404,Swift,13,Codeless drop-in universal library allows to prevent issues of keyboard sliding up and cover UITextField/UITextView. Neither need to write any code nor any setup required and much more.,2024-08-05T16:34:46Z
23,OpenEmu,OpenEmu,https://github.com/OpenEmu/OpenEmu,16021,1246,Swift,332,🕹 Retro video game emulation for macOS,2024-07-16T08:50:12Z
24,SwiftGuide,ipader,https://github.com/ipader/SwiftGuide,15979,3557,Swift,0,Swift Featured Projects in brain Mapping,2023-04-05T09:09:08Z
25,Moya,Moya,https://github.com/Moya/Moya,15067,1976,Swift,157,Network abstraction layer written in Swift.,2024-08-05T11:56:59Z
26,Design-Patterns-In-Swift,ochococo,https://github.com/ochococo/Design-Patterns-In-Swift,15062,1740,Swift,4,📖 Design Patterns implemented in Swift 5.0,2024-08-03T07:30:28Z
27,Carthage,Carthage,https://github.com/Carthage/Carthage,14937,1548,Swift,184,"A simple, decentralized dependency manager for Cocoa",2024-06-17T14:37:14Z
28,Amethyst,ianyh,https://github.com/ianyh/Amethyst,14519,484,Swift,356,Automatic tiling window manager for macOS à la xmonad.,2024-07-23T04:01:56Z
29,PromiseKit,mxcl,https://github.com/mxcl/PromiseKit,14220,1453,Swift,11,Promises for Swift & ObjC.,2024-06-03T09:37:55Z
30,Mos,Caldis,https://github.com/Caldis/Mos,14162,510,Swift,254,"一个用于在 macOS 上平滑你的鼠标滚动效果或单独设置滚动方向的小工具, 让你的滚轮爽如触控板  \",A lightweight tool used to smooth scrolling and set scroll direction independently for your mouse on macOS
31,Spring,MengTo,https://github.com/MengTo/Spring,14080,1801,Swift,131,A library to simplify iOS animations in Swift.,2023-07-03T14:28:34Z
32,SwifterSwift,SwifterSwift,https://github.com/SwifterSwift/SwifterSwift,13889,1618,Swift,19,A handy collection of more than 500 native Swift extensions to boost your productivity.,2024-07-20T12:32:15Z
33,Perfect,PerfectlySoft,https://github.com/PerfectlySoft/Perfect,13840,945,Swift,54,"Server-side Swift. The Perfect core toolset and framework for Swift Developers. (For mobile back-end development, website and API development, and more…)",2024-02-03T15:38:39Z
34,SkeletonView,Juanpe,https://github.com/Juanpe/SkeletonView,12548,1105,Swift,72,☠️ An elegant way to show users that something is happening and also prepare them to which contents they are awaiting,2024-08-06T18:38:09Z
35,firefox-ios,mozilla-mobile,https://github.com/mozilla-mobile/firefox-ios,12114,2888,Swift,1784,Firefox for iOS,2024-08-11T02:25:03Z
36,swift-composable-architecture,pointfreeco,https://github.com/pointfreeco/swift-composable-architecture,12031,1423,Swift,6,"A library for building applications in a consistent and understandable way, with composition, testing, and ergonomics in mind.",2024-08-10T23:45:34Z
37,Material,CosmicMind,https://github.com/CosmicMind/Material,11987,1262,Swift,31,A UI/UX framework for creating beautiful applications.,2022-05-16T17:39:01Z
38,Eureka,xmartlabs,https://github.com/xmartlabs/Eureka,11757,1328,Swift,160,Elegant iOS form builder in Swift,2024-05-23T21:59:52Z
39,Maccy,p0deje,https://github.com/p0deje/Maccy,11615,500,Swift,42,Lightweight clipboard manager for macOS,2024-08-09T15:41:39Z
40,30DaysofSwift,allenwong,https://github.com/allenwong/30DaysofSwift,11504,2045,Swift,7,A self-taught project to learn Swift.,2022-05-21T17:40:30Z
41,Whisky,Whisky-App,https://github.com/Whisky-App/Whisky,11473,246,Swift,266,A modern Wine wrapper for macOS built with SwiftUI,2024-08-09T12:22:18Z
42,AltStore,altstoreio,https://github.com/altstoreio/AltStore,11452,865,Swift,474,AltStore is an alternative app store for non-jailbroken iOS devices.,2024-04-23T11:33:58Z
43,Ice,jordanbaird,https://github.com/jordanbaird/Ice,11443,215,Swift,67,Powerful menu bar manager for macOS,2024-08-10T13:32:08Z
44,animated-tab-bar,Ramotion,https://github.com/Ramotion/animated-tab-bar,11119,1327,Swift,9,:octocat: RAMAnimatedTabBarController is a Swift UI module library for adding animation to iOS tabbar items and icons. iOS library made by @Ramotion,2022-01-26T02:40:50Z
45,hidden,dwarvesf,https://github.com/dwarvesf/hidden,11094,293,Swift,112,An ultra-light MacOS utility that helps hide menu bar icons,2023-08-15T15:05:34Z
46,mas,mas-cli,https://github.com/mas-cli/mas,10749,271,Swift,85,:package: Mac App Store command line interface,2024-08-03T21:00:23Z
47,Signal-iOS,signalapp,https://github.com/signalapp/Signal-iOS,10653,2965,Swift,103,A private messenger for iOS.,2024-08-09T17:06:49Z
48,NVActivityIndicatorView,ninjaprox,https://github.com/ninjaprox/NVActivityIndicatorView,10598,1154,Swift,12,A collection of awesome loading animations,2024-04-17T15:35:05Z
49,AudioKit,AudioKit,https://github.com/AudioKit/AudioKit,10573,1548,Swift,20,"Audio synthesis, processing, & analysis platform for iOS, macOS and tvOS",2024-07-17T16:38:23Z
50,alt-tab-macos,lwouis,https://github.com/lwouis/alt-tab-macos,10337,316,Swift,89,Windows alt-tab on macOS,2024-08-10T09:19:27Z
51,folding-cell,Ramotion,https://github.com/Ramotion/folding-cell,10217,1150,Swift,8,:octocat: 📃 FoldingCell is an expanding content cell with animation made by @Ramotion,2024-04-28T23:42:52Z
52,CryptoSwift,krzyzanowskim,https://github.com/krzyzanowskim/CryptoSwift,10121,1652,Swift,0,CryptoSwift is a growing collection of standard and secure cryptographic algorithms implemented in Swift,2024-08-05T18:24:53Z
53,pock,pock,https://github.com/pock/pock,10092,371,Swift,59,Widgets manager for MacBook Touch Bar,2022-11-12T18:15:22Z
54,Quick,Quick,https://github.com/Quick/Quick,9782,909,Swift,29,The Swift (and Objective-C) testing framework.,2024-08-05T09:31:01Z
55,swift-package-manager,swiftlang,https://github.com/swiftlang/swift-package-manager,9675,1320,Swift,675,The Package Manager for the Swift Programming Language,2024-08-10T18:38:05Z
56,FlappySwift,newlinedotco,https://github.com/newlinedotco/FlappySwift,9671,2683,Swift,3,swift implementation of flappy bird. More at fullstackedu.com,2023-04-29T03:44:50Z
57,SQLite.swift,stephencelis,https://github.com/stephencelis/SQLite.swift,9614,1550,Swift,118,"A type-safe, Swift-language layer over SQLite3.",2024-07-22T03:18:15Z
58,R.swift,mac-cain13,https://github.com/mac-cain13/R.swift,9464,755,Swift,87,"Strong typed, autocompleted resources like images, fonts and segues in Swift projects",2024-07-11T17:42:39Z
59,iOSInterviewQuestions,ChenYilong,https://github.com/ChenYilong/iOSInterviewQuestions,9329,2763,Swift,65,iOS interview questions;iOS面试题集锦（附答案）--学习qq群或 Telegram 群交流 https://github.com/ChenYilong/iOSBlog/issues/21,2024-07-22T10:04:37Z
60,DevToysMac,DevToys-app,https://github.com/DevToys-app/DevToysMac,9211,359,Swift,71,DevToys For mac,2024-05-03T04:09:41Z
61,SwiftGen,SwiftGen,https://github.com/SwiftGen/SwiftGen,9202,730,Swift,112,"The Swift code generator for your assets, storyboards, Localizable.strings, … — Get rid of all String-based APIs!",2024-07-19T15:53:13Z
62,eul,gao-sun,https://github.com/gao-sun/eul,9182,345,Swift,62,🖥️ macOS status monitoring app written in SwiftUI.,2024-05-25T22:59:12Z
63,ObjectMapper,tristanhimmelman,https://github.com/tristanhimmelman/ObjectMapper,9123,1033,Swift,54,Simple JSON Object mapping written in Swift,2024-05-02T13:32:48Z
64,IBAnimatable,IBAnimatable,https://github.com/IBAnimatable/IBAnimatable,8670,780,Swift,45,"Design and prototype customized UI, interaction, navigation, transition and animation for App Store ready Apps in Interface Builder with IBAnimatable.",2023-02-21T11:14:59Z
65,WWDC,insidegui,https://github.com/insidegui/WWDC,8587,772,Swift,19,The unofficial WWDC app for macOS,2024-06-20T12:37:55Z
66,ios-oss,kickstarter,https://github.com/kickstarter/ios-oss,8433,1242,Swift,3,"Kickstarter for iOS. Bring new ideas to life, anywhere.",2024-08-07T18:45:50Z
67,Starscream,daltoniam,https://github.com/daltoniam/Starscream,8241,1191,Swift,129,Websockets in swift for iOS and OSX,2024-05-16T21:37:05Z
68,gitignore.io,toptal,https://github.com/toptal/gitignore.io,8182,618,Swift,18,Create useful .gitignore files for your project,2024-06-13T14:02:47Z
69,PlayCover,PlayCover,https://github.com/PlayCover/PlayCover,8140,753,Swift,327,Community fork of PlayCover,2024-08-09T19:09:33Z
70,NetNewsWire,Ranchero-Software,https://github.com/Ranchero-Software/NetNewsWire,8137,518,Swift,772,RSS reader for macOS and iOS.,2024-08-06T04:35:16Z
71,openhaystack,seemoo-lab,https://github.com/seemoo-lab/openhaystack,8126,444,Swift,118,Build your own 'AirTags' 🏷 today! Framework for tracking personal Bluetooth devices via Apple's massive Find My network.,2024-07-09T07:19:10Z
72,Dozer,Mortennn,https://github.com/Mortennn/Dozer,8081,255,Swift,87,Hide menu bar icons on macOS,2023-11-30T13:45:27Z
73,Swift-30-Projects,soapyigu,https://github.com/soapyigu/Swift-30-Projects,8036,1818,Swift,4,30 mini Swift Apps for self-study,2023-06-07T19:22:26Z
74,LTMorphingLabel,lexrus,https://github.com/lexrus/LTMorphingLabel,8028,782,Swift,24,[EXPERIMENTAL] Graceful morphing effects for UILabel written in Swift.,2024-02-24T06:05:55Z
75,Nuke,kean,https://github.com/kean/Nuke,7984,519,Swift,12,Image loading system,2024-08-08T20:09:00Z
76,Reachability.swift,ashleymills,https://github.com/ashleymills/Reachability.swift,7925,944,Swift,79,Replacement for Apple's Reachability re-written in Swift with closures,2024-05-24T08:26:03Z
77,swift-nio,apple,https://github.com/apple/swift-nio,7889,638,Swift,179,"Event-driven network application framework for high performance protocol servers & clients, non-blocking.",2024-08-10T12:06:20Z
78,KeychainAccess,kishikawakatsumi,https://github.com/kishikawakatsumi/KeychainAccess,7877,780,Swift,44,"Simple Swift wrapper for Keychain that works on iOS, watchOS, tvOS and macOS.",2024-05-31T12:29:46Z
79,Awesome-ARKit,olucurious,https://github.com/olucurious/Awesome-ARKit,7830,918,Swift,4,A curated list of awesome ARKit projects and resources. Feel free to contribute!,2024-05-09T12:55:22Z
80,facebook-ios-sdk,facebook,https://github.com/facebook/facebook-ios-sdk,7756,3522,Swift,192,Used to integrate the Facebook Platform with your iOS & tvOS apps.,2024-08-08T22:36:20Z
81,SwiftFormat,nicklockwood,https://github.com/nicklockwood/SwiftFormat,7732,628,Swift,283,A command-line tool and Xcode Extension for formatting Swift code,2024-08-10T17:28:33Z
82,AlDente-Charge-Limiter,AppHouseKitchen,https://github.com/AppHouseKitchen/AlDente-Charge-Limiter,7713,286,Swift,98,macOS menubar tool to set Charge Limits and prolong battery lifespan,2024-07-08T14:12:55Z
83,Gifski,sindresorhus,https://github.com/sindresorhus/Gifski,7665,289,Swift,24,🌈 Convert videos to high-quality GIFs on your Mac,2024-06-26T17:42:32Z
84,Kitura,Kitura,https://github.com/Kitura/Kitura,7628,495,Swift,76,A Swift web framework and HTTP server.,2022-10-07T05:43:45Z
85,Sourcery,krzysztofzablocki,https://github.com/krzysztofzablocki/Sourcery,7628,610,Swift,55,"Meta-programming for Swift, stop writing boilerplate code.",2024-08-08T11:10:13Z
86,SwiftDate,malcommac,https://github.com/malcommac/SwiftDate,7597,767,Swift,72,"🐔 Toolkit to parse, validate, manipulate, compare and display dates, time & timezones in Swift.",2023-09-19T09:59:48Z
87,JTAppleCalendar,patchthecode,https://github.com/patchthecode/JTAppleCalendar,7540,804,Swift,72,The Unofficial Apple iOS Swift Calendar View. Swift calendar Library. iOS calendar Control. 100% Customizable,2024-07-23T19:01:40Z
88,ReSwift,ReSwift,https://github.com/ReSwift/ReSwift,7530,520,Swift,42,Unidirectional Data Flow in Swift - Inspired by Redux,2024-04-22T14:51:58Z
89,Lona,Lona,https://github.com/Lona/Lona,7524,266,Swift,18,"A tool for defining design systems and using them to generate cross-platform UI code, Sketch files, and other artifacts.",2023-01-04T21:40:53Z
90,Clipy,Clipy,https://github.com/Clipy/Clipy,7514,632,Swift,219,Clipboard extension app for macOS.,2024-06-29T14:02:13Z
91,CopilotForXcode,intitni,https://github.com/intitni/CopilotForXcode,7462,352,Swift,31,"The missing GitHub Copilot, Codeium and ChatGPT Xcode Source Editor Extension",2024-08-10T17:32:26Z
92,Cartography,robb,https://github.com/robb/Cartography,7347,524,Swift,61,A declarative Auto Layout DSL for Swift :iphone::triangular_ruler:,2023-11-07T11:29:48Z
93,SwiftMessages,SwiftKickMobile,https://github.com/SwiftKickMobile/SwiftMessages,7276,742,Swift,40,A very flexible message bar for UIKit and SwiftUI.,2024-08-07T10:57:14Z
94,MochiDiffusion,MochiDiffusion,https://github.com/MochiDiffusion/MochiDiffusion,7274,346,Swift,16,Run Stable Diffusion on Mac natively,2024-08-05T00:23:17Z
95,ViewAnimator,marcosgriselli,https://github.com/marcosgriselli/ViewAnimator,7255,484,Swift,7,ViewAnimator brings your UI to life with just one line,2024-03-31T11:37:25Z
96,FSPagerView,WenchaoD,https://github.com/WenchaoD/FSPagerView,7141,955,Swift,152,FSPagerView is an elegant Screen Slide Library. It is extremely helpful for making Banner View、Product Show、Welcome/Guide Pages、Screen/ViewController Sliders.,2024-06-29T17:34:52Z
97,react-native-video,TheWidlarzGroup,https://github.com/TheWidlarzGroup/react-native-video,7105,2864,Swift,209,A <Video /> component for react-native,2024-08-10T16:56:13Z
98,react-native-vision-camera,mrousavy,https://github.com/mrousavy/react-native-vision-camera,7081,1047,Swift,75,"📸 A powerful, high-performance React Native Camera library.",2024-08-07T13:26:18Z
99,secretive,maxgoedjen,https://github.com/maxgoedjen/secretive,7033,155,Swift,116,Store SSH keys in the Secure Enclave,2024-07-25T13:34:01Z
100,About-SwiftUI,Juanpe,https://github.com/Juanpe/About-SwiftUI,6983,677,Swift,0,"Gathering all info published, both by Apple and by others, about new framework SwiftUI.",2022-10-28T15:59:18Z
